[{"category":"package","code":"KF-PKG-001","details":{},"help":null,"message":"package input is invalid","package_path":null,"retry":"never","severity":"error","source_range":null,"stage":"validate"},{"category":"package","code":"KF-PKG-002","details":{},"help":null,"message":"package input escapes its boundary","package_path":null,"retry":"never","severity":"error","source_range":null,"stage":"validate"},{"category":"lock","code":"KF-LOCK-001","details":{},"help":null,"message":"lock input is stale","package_path":null,"retry":"never","severity":"error","source_range":null,"stage":"resolve"},{"category":"lock","code":"KF-LOCK-002","details":{},"help":null,"message":"lock input failed integrity validation","package_path":null,"retry":"never","severity":"error","source_range":null,"stage":"resolve"},{"category":"catalog","code":"KF-CAT-001","details":{},"help":null,"message":"catalog has no compatible candidate","package_path":null,"retry":"never","severity":"error","source_range":null,"stage":"lock"},{"category":"feature","code":"KF-FEAT-001","details":{},"help":null,"message":"required feature is unsupported","package_path":null,"retry":"never","severity":"error","source_range":null,"stage":"resolve"},{"category":"authorization","code":"KF-AUTH-001","details":{},"help":null,"message":"admission was denied","package_path":null,"retry":"never","severity":"error","source_range":null,"stage":"admit"},{"category":"authorization","code":"KF-AUTH-002","details":{},"help":null,"message":"admission evidence expired","package_path":null,"retry":"never","severity":"error","source_range":null,"stage":"admit"},{"category":"authorization","code":"KF-AUTH-003","details":{},"help":null,"message":"invocation was denied","package_path":null,"retry":"never","severity":"error","source_range":null,"stage":"invoke"},{"category":"authorization","code":"KF-AUTH-004","details":{},"help":null,"message":"authorization policy is stale","package_path":null,"retry":"never","severity":"error","source_range":null,"stage":"invoke"},{"category":"capability","code":"KF-CAP-001","details":{},"help":null,"message":"capability precondition is missing","package_path":null,"retry":"never","severity":"error","source_range":null,"stage":"invoke"},{"category":"capability","code":"KF-CAP-002","details":{},"help":null,"message":"capability result is invalid","package_path":null,"retry":"never","severity":"error","source_range":null,"stage":"invoke"},{"category":"capability","code":"KF-CAP-003","details":{},"help":null,"message":"capability outcome is unknown","package_path":null,"retry":"never","severity":"error","source_range":null,"stage":"invoke"},{"category":"audit","code":"KF-AUDIT-001","details":{},"help":null,"message":"audit service is unavailable","package_path":null,"retry":"never","severity":"error","source_range":null,"stage":"audit"},{"category":"runtime","code":"KF-RUNTIME-001","details":{},"help":null,"message":"runtime component is unresolved","package_path":null,"retry":"never","severity":"error","source_range":null,"stage":"resolve"},{"category":"runtime","code":"KF-RUNTIME-002","details":{},"help":null,"message":"runtime construction failed","package_path":null,"retry":"never","severity":"error","source_range":null,"stage":"runtime"}]
